{
  "schema": "umicom.workbench-layout-data-defaults/1",
  "authority": "Umicom Data Server",
  "replication": {
    "direction": "bidirectional",
    "continue_after_conflict": true,
    "maximum_operations": 256,
    "lease_duration_ms": 30000,
    "presence_ttl_ms": 45000
  },
  "outbox": {
    "maximum_attempts": 8,
    "lease_duration_ms": 30000,
    "retry_delay_ms": 5000
  },
  "offline": {
    "maximum_attempts": 8,
    "claim_duration_ms": 30000,
    "retry_delay_ms": 5000
  },
  "retention": {
    "revisions_per_layout": 64,
    "delivered_outbox_ms": 604800000,
    "resolved_conflict_ms": 2592000000,
    "completed_operation_ms": 604800000,
    "expired_presence_ms": 300000
  },
  "health": {
    "maximum_pending_outbox": 100,
    "maximum_open_conflicts": 50,
    "maximum_pending_offline_operations": 100,
    "maximum_failure_age_ms": 300000
  }
}
